{
  "assignment_id": "HW1",
  "student_id": "synth_hw1_trial_007",
  "seed": 10623327485749949871,
  "num_qubits": 4,
  "shots": 2048,
  "measurement_mode": "reversed",
  "measurement_map": [
    [
      0,
      3
    ],
    [
      1,
      2
    ],
    [
      2,
      1
    ],
    [
      3,
      0
    ]
  ],
  "initial_bits_q0_to_qn": [
    1,
    0,
    0,
    0
  ],
  "flip_mask_q0_to_qn": [
    1,
    0,
    1,
    0
  ],
  "final_bits_q0_to_qn": [
    0,
    0,
    1,
    0
  ],
  "expected_logical_qn_to_q0": "0100",
  "expected_display_bitstring": "0010",
  "counts": {
    "0010": 2048
  },
  "dominant_bitstring": "0010",
  "reflection_bit_order": "The measurement map is reversed: q[0] maps to c[3], q[1] maps to c[2], q[2] maps to c[1], and q[3] maps to c[0]. The final qubit values in q[0]...q[3] order are [0, 0, 1, 0], so the classical bits become c[0]=0, c[1]=1, c[2]=0, c[3]=0. Qiskit displays count keys in c[3]c[2]c[1]c[0] order, which gives 0010.",
  "reflection_bit_flip": "The initial bits were [1, 0, 0, 0] and the seeded flip mask was [1, 0, 1, 0]. Applying X where the mask is 1 flips q[0] from 1 to 0 and q[2] from 0 to 1, so initial_bits XOR flip_mask produces [0, 0, 1, 0]."
}