{
  "assignment_id": "HW1",
  "student_id": "synth_hw1_trial_008",
  "seed": 2756932609756395744,
  "num_qubits": 4,
  "shots": 2048,
  "measurement_mode": "reversed",
  "measurement_map": [
    [
      0,
      3
    ],
    [
      1,
      2
    ],
    [
      2,
      1
    ],
    [
      3,
      0
    ]
  ],
  "initial_bits_q0_to_qn": [
    0,
    0,
    1,
    1
  ],
  "flip_mask_q0_to_qn": [
    0,
    0,
    1,
    0
  ],
  "final_bits_q0_to_qn": [
    0,
    0,
    0,
    1
  ],
  "expected_logical_qn_to_q0": "1000",
  "expected_display_bitstring": "0001",
  "counts": {
    "0001": 2048
  },
  "dominant_bitstring": "0001",
  "reflection_bit_order": "The measurement map is reversed: q[0] maps to c[3], q[1] maps to c[2], q[2] maps to c[1], and q[3] maps to c[0]. After the flips, the qubits q[0] through q[3] are [0, 0, 0, 1], so the classical bits are c[0] through c[3] = [1, 0, 0, 0]. Qiskit displays count keys in the order c[3]c[2]c[1]c[0], so the displayed bitstring is 0001.",
  "reflection_bit_flip": "The initial qubit pattern q[0] through q[3] was [0, 0, 1, 1]. The seeded flip mask was [0, 0, 1, 0], so only q[2] received an additional X gate and changed from 1 to 0. Taking the bitwise XOR of the initial bits and the flip mask gives the final pattern [0, 0, 0, 1]."
}